{
  "slug": "signup",
  "domain": "auth",
  "title": "Signup (Email + OTP)",
  "persona": "auth",
  "description": "New user registers with email and password, verifies via 6-digit OTP code, and gets a session. Includes invite auto-accept, cart merge, and recently-viewed merge as background side effects.",
  "relatedIssues": [
    159,
    254
  ],
  "flows": [
    {
      "id": "register",
      "title": "Register & Verify Email",
      "trigger": "User clicks Sign Up in navbar modal",
      "steps": [
        {
          "id": "open-modal",
          "title": "Open Sign Up Modal",
          "action": "click",
          "layer": "client",
          "status": "built",
          "tooltip": "User clicks Sign Up in navbar, modal opens with RegisterForm",
          "codeRef": "src/features/auth/components/register-form/index.tsx"
        },
        {
          "id": "enter-credentials",
          "title": "Enter Credentials",
          "action": "type",
          "layer": "client",
          "status": "built",
          "tooltip": "Email + password fields with client-side validation: email format, password min 8 chars"
        },
        {
          "id": "submit-register",
          "title": "Create User Account",
          "method": "POST",
          "layer": "server",
          "status": "built",
          "route": "/api/auth/register",
          "codeRef": "src/app/api/auth/register/route.ts",
          "tooltip": "Admin client creates user, bypassing email confirmation flow. Triggers Supabase to send OTP email.",
          "errorCases": [
            {
              "condition": "Email already registered",
              "result": "Show inline 'Sign in instead' link",
              "httpStatus": 409
            }
          ]
        },
        {
          "id": "transition-to-otp",
          "title": "Show OTP Input",
          "layer": "client",
          "status": "built",
          "tooltip": "Form transitions to OTP input in same modal, no page change"
        },
        {
          "id": "enter-otp",
          "title": "Enter OTP Code",
          "action": "type",
          "layer": "client",
          "status": "built",
          "tooltip": "User enters 6-digit code from email",
          "codeRef": "src/features/auth/components/otp-input/index.tsx"
        },
        {
          "id": "verify-otp",
          "title": "Verify OTP",
          "layer": "server",
          "status": "built",
          "tooltip": "verifyOtp(type='signup') — on success, Supabase sets session cookies",
          "errorCases": [
            {
              "condition": "Invalid/expired code",
              "result": "Show error, allow retry"
            }
          ]
        }
      ],
      "branches": [
        {
          "afterStep": "enter-otp",
          "condition": "Code not received?",
          "paths": [
            {
              "label": "Resend",
              "detail": "Resend OTP with 60s cooldown",
              "goTo": "transition-to-otp"
            }
          ]
        }
      ]
    },
    {
      "id": "post-auth-side-effects",
      "title": "Post-Auth Background Side Effects",
      "trigger": "Session established after OTP verification",
      "steps": [
        {
          "id": "invite-check",
          "title": "Check Invite Token",
          "layer": "background",
          "status": "built",
          "tooltip": "Token was stored in Navbar state from ?register=true&invite={token}. Threaded to OtpInput via props."
        },
        {
          "id": "auto-accept-invite",
          "title": "Auto-Accept Invite",
          "layer": "background",
          "status": "built",
          "codeRef": "src/features/shops/services/shop-invites.ts",
          "tooltip": "acceptShopInvite(token) — only fires if invite token present. Failure never blocks. See shop-invite-acceptance.json."
        },
        {
          "id": "cart-merge",
          "title": "Merge Guest Cart",
          "layer": "background",
          "status": "built",
          "codeRef": "src/features/cart/hooks/use-cart-merge.ts",
          "tooltip": "useCartMerge() merges localStorage cart to DB. Silent, no toast. See guest-cart.json."
        },
        {
          "id": "recently-viewed-merge",
          "title": "Merge Recently Viewed",
          "layer": "background",
          "status": "built",
          "codeRef": "src/features/recently-viewed/hooks/use-recently-viewed-merge.ts",
          "tooltip": "useRecentlyViewedMerge() — POST /api/recently-viewed/merge. Deduplicates on server. Silent."
        },
        {
          "id": "onboarding-check",
          "title": "Check Onboarding",
          "layer": "client",
          "status": "built",
          "tooltip": "Check onboarding_completed_at on member record. If null → banner appears. If set → user stays on current page."
        }
      ]
    }
  ]
}
